{
  "domain": "www.cadillacofgreenwich.com",
  "version": "1.0.0",
  "enabled": true,
  "debug": true,
  "pages": {
    "mode": "include",
    "patterns": ["/"]
  },
  "disableInterception": true,
  "idleTimeout": 3000,
  "delayedTimeout": 10000,
  "allowScripts": [
    "dealeron.js",
    "dealeron.static",
    "do_utility",
    "cdn.dlron.us",
    "dlron.us",
    "jquery",
    "bootstrap",
    "modernizr",
    "coreBundle",
    "navigation.min.js",
    "ua-parser",
    "userAgent-detection",
    "jquery.validate",
    "dealerOnLeadsBundle",
    "locationSortInjection",
    "formPhoneUtility",
    "homepageBanners",
    "bannerManager",
    "homepageSearchWidgetCosmosBundle",
    "lazyLoadHomepage"
  ],
  "deferScripts": [
    "googletagmanager.com",
    "gtag",
    "gtm.js",
    "analytics.js",
    "ga.js",
    "dotagging.js",
    "taggbaa.dealeron.com",
    "dealerOnTrack",
    "gmGlobalEvents",
    "facebook.net",
    "fbevents.js",
    "doubleclick.net",
    "adservice",
    "tracking",
    "bing.com/clarity",
    "mouseflow",
    "crazyegg",
    "hotjar",
    "quantcast"
  ],
  "delayedScripts": [
    "prsnbaa.dealeron.com",
    "personalization.js",
    "banrsaa.dealeron.com",
    "banner.js",
    "priceTrack",
    "vclwsaa",
    "carcodesms.com",
    "widgets",
    "validate.audio",
    "harmoniq",
    "sincrod.com",
    "init.umd.js"
  ],
  "preconnect": [
    "https://cdn.dlron.us",
    "https://taggbaa.dealeron.com",
    "https://prsnbaa.dealeron.com",
    "https://banrsaa.dealeron.com",
    "https://www.googletagmanager.com",
    "https://fonts.googleapis.com",
    "https://fonts.gstatic.com",
    "https://use.typekit.net"
  ],
  "preload": [],
  "criticalCssInline": "",
  "notes": {
    "platform": "DealerOn CMS v22.92.0",
    "dealerId": "27114",
    "pages": "HOMEPAGE ONLY - Currently set to include mode with pattern '/'. Speed Layer only runs on homepage. To enable site-wide, change mode to 'all' or add more patterns.",
    "allowScripts": "DealerOn core platform scripts - must load immediately for site functionality. Includes jQuery, Bootstrap, navigation, forms, and core components.",
    "deferScripts": "Analytics and tracking scripts deferred to 3 seconds or user interaction. Includes 5 GTM containers, DealerOn tagging, and third-party analytics.",
    "delayedScripts": "Heavy widgets and personalization delayed to 10 seconds. Includes chat (CarCode SMS), personalization engine, banner system, price tracking, and Harmoniq CRM.",
    "disableInterception": "Set to true due to ComplyAuto blocker.js compatibility (similar to Victory Ottawa). ComplyAuto uses its own Proxy interception which may conflict.",
    "gtmContainers": "GTM-KGGLWR3, GTM-PQW5KW8L, GTM-W33G7Q5, GTM-K7QPBHS, GTM-5HVJJR9F, GTM-MLHK883",
    "thirdPartyServices": {
      "compliance": "ComplyAuto cookie banner and blocker",
      "chat": "CarCode SMS widgets",
      "crm": "Harmoniq (Sincro) integration",
      "personalization": "DealerOn personalization engine",
      "banners": "DealerOn banner system",
      "fonts": "Adobe Typekit (hrx7xqc, gpc7ewp)",
      "validation": "ValidateAudio tag validation"
    },
    "optimizationStrategy": "Conservative approach with disableInterception due to ComplyAuto. DOM observer remains active for lazy loading. Core DealerOn scripts load immediately, analytics defer to 3s, heavy widgets delay to 10s."
  }
}
