{
  "domain": "victoryottawa.com",
  "version": "1.0.0",
  "enabled": true,
  "debug": true,
  "disableInterception": true,
  "idleTimeout": 3000,
  "delayedTimeout": 15000,
  "allowScripts": [
    "dealerinspire.com",
    "di-assets.com",
    "jquery",
    "bootstrap",
    "core.js",
    "main.js",
    "vendor.js"
  ],
  "deferScripts": [
    "swiper",
    "online-shopper",
    "font-awesome",
    "animate.min.css",
    "di-stacks",
    "di-modal",
    "datadog",
    "datadoghq",
    "google-analytics.com",
    "googletagmanager.com",
    "gtag",
    "analytics.js",
    "ga.js",
    "facebook.net",
    "fbevents.js",
    "doubleclick.net",
    "adservice",
    "tracking",
    "hotjar",
    "mouseflow",
    "crazyegg",
    "quantcast",
    "bing.com/clarity"
  ],
  "delayedScripts": [
    "autoleadstar.com",
    "cdn.autoleadstar.com",
    "dai.autoleadstar.com"
  ],
  "preconnect": [
    "https://fonts.googleapis.com",
    "https://fonts.gstatic.com",
    "https://www.google-analytics.com",
    "https://www.googletagmanager.com"
  ],
  "preload": [
    {
      "url": "https://fonts.googleapis.com/css2?family=Roboto:wght@400;700&display=swap",
      "as": "style",
      "crossorigin": "anonymous"
    }
  ],
  "criticalCssInline": "",
  "notes": {
    "allowScripts": "Platform-critical scripts that must execute immediately for site functionality",
    "deferScripts": "Analytics, tracking, and ad scripts that can wait for user interaction",
    "preconnect": "Domains to establish early connections to",
    "preload": "Critical resources to fetch early",
    "criticalCssInline": "Above-the-fold CSS to eliminate render-blocking requests"
  }
}
