{
  "domain": "www.toyotaofscranton.com",
  "version": "1.0.0",
  "enabled": true,
  "debug": true,
  "disableInterception": false,
  "idleTimeout": 3000,
  "blockScripts": [
    "localhost",
    "127.0.0.1",
    "refresh.js"
  ],
  "allowScripts": [
    "dealerinspire.com",
    "di-assets.com",
    "jquery",
    "bootstrap",
    "swiper",
    "font-awesome",
    "animate",
    "di-stacks",
    "di-modal",
    "core.js",
    "main.js",
    "vendor.js"
  ],
  "deferScripts": [
    "google-analytics.com",
    "googletagmanager.com",
    "gtag",
    "analytics.js",
    "ga.js",
    "facebook.net",
    "fbevents.js",
    "doubleclick.net",
    "adservice",
    "tracking",
    "mouseflow",
    "crazyegg",
    "quantcast",
    "bing.com/clarity",
    "callrail",
    "complyauto.com"
  ],
  "delayedScripts": [
    "api.mapbox.com",
    "cdn.revolutionparts.com",
    "hotjar",
    "online-shopper",
    "cdn.gubagoo.io",
    "gubagoo.io",
    "sd.iperceptions.com",
    "iperceptions.com",
    "ver.ev5.ai",
    "datadoghq-browser-agent.com",
    "datadog",
    "datadoghq",
    "extremereach.io"
  ],
  "preconnect": [
    "https://fonts.googleapis.com",
    "https://fonts.gstatic.com",
    "https://www.google-analytics.com",
    "https://www.googletagmanager.com"
  ],
  "preload": [],
  "criticalCssInline": "",
  "notes": {
    "allowScripts": "All DealerInspire scripts load immediately for full functionality",
    "deferScripts": "Only analytics and tracking scripts are deferred to 3 seconds",
    "delayedScripts": "Empty - no chat widget to delay",
    "purpose": "Conservative configuration to test Speed Layer without complications"
  }
}